<?xml version="1.0" encoding="utf-8"?>
<!-- 
  Error 1: The root element is "Hotel" instead of "Hotels".
-->
<Hotel xmlns:xsi="http://www.w3.org/2001/XMLSchema-instance"
       xsi:noNamespaceSchemaLocation="https://Cory-Athmer.github.io/yourrepo/Hotels.xsd">

	<!-- 
    Error 2: Missing required attribute "HotelID". 
    Error 5: Two Name elements provided
    Error 4: <Address> element is missing its closing tag.
  -->
	<Hotel SomeOptionalAttr="VIP">
		<Name>Westin</Name>
		<Name>ExtraName</Name>
		<!-- Duplicate Name error -->
		<Phone>480-968-8885</Phone>
		<Phone>800-937-8461</Phone> 
		<Address NearestAirport="Sky Harbor">
			<Number>11</Number>	
			<Street>E 7th St</Street>
			<City>Tempe</City>
			<State>AZ</State>
			<Zip>85281</Zip>
			<!--  </Address> closing tag is missing-->
			<Rating>4.2</Rating>
		</Hotel>

	<!-- 
    Error 3 Missing phone element altogether
  -->
	<Hotel HotelID="H002">
		<Name>Marriott Downtown</Name>
		<!-- No Phone element here -->
		<Address NearestAirport="Sky Harbor">
			<Number>100</Number>
			<Street>2nd St</Street>
			<City>Tempe</City>
			<State>AZ</State>	
			<Zip>85281</Zip>
		</Address>
	</Hotel>

</Hotel>
